{
  "@context": "http://smart.who.int/kg/l1.context.jsonld",
  "id": "http://smart.who.int/immunizations/kg/l1",
  "type": "Entity",
  "ontologyVersion": "1.0",
  "generatedAt": "2026-09-09T15:01:59Z",
  "wasDerivedFrom": [
    {
      "path": "../smart-base/input/dmn/DAK.DT.IMMZ.D2.DT.BCG.dmn",
      "sha256": "1bc304742035ddfd4d9857d9661b98b1f41aee1b4dfb41db13e5eb2cec2fbcd0"
    }
  ],
  "nodes": [
    {
      "id": "http://smart.who.int/immunizations/artifact/DAK.DT.IMMZ.D2.DT.BCG",
      "type": "external-artifact",
      "label": "IMMZ.D2 Determine required vaccination(s) if any",
      "properties": {
        "iri": "http://smart.who.int/immunizations/artifact/DAK.DT.IMMZ.D2.DT.BCG",
        "targetKind": "dmn:DecisionTable"
      },
      "derivation": "derived",
      "skill": "kg/extract-citations"
    },
    {
      "id": "http://smart.who.int/immunizations/citation/601a58741d62",
      "type": "citation",
      "label": "WHO recommendations for routine immunization – summary tables (March 2023) (1)",
      "properties": {
        "text": "WHO recommendations for routine immunization – summary tables (March 2023) (1)",
        "location": "../smart-base/input/dmn/DAK.DT.IMMZ.D2.DT.BCG.dmn#rule.DAK.DT.IMMZ.D2.DT.BCG.rule.NoBCGprimaryseries4747864bda",
        "numbering": "1",
        "resolutionStatus": "unresolved"
      },
      "derivation": "derived",
      "note": "Copied verbatim from the rule's L1 reference annotation. Resolution to a publication is deliberately not attempted here.",
      "skill": "kg/extract-citations"
    }
  ],
  "edges": [
    {
      "type": "Statement",
      "predicate": "appearsIn",
      "source": "http://smart.who.int/immunizations/citation/601a58741d62",
      "target": "http://smart.who.int/immunizations/artifact/DAK.DT.IMMZ.D2.DT.BCG",
      "derivation": "derived",
      "skill": "kg/extract-citations"
    }
  ]
}
